{"id":51,"type":"automation-event.changed","schema_version":"1","occurred_at":"2026-07-24T07:00:01Z","task_id":null,"payload":{"automation_event_id":"019f0000-0000-7000-8000-000000000082","projection_version":3,"status":"retry-wait","action":"create-download","failure_code":"integration.unavailable"}}
